{
  "case_id": "CASE-DEMO-001",
  "patient_id": "PATIENT-DEIDENTIFIED-001",
  "encounter_id": "ENC-DEMO-001",
  "admitted_at": "2026-06-01T09:00:00Z",
  "discharged_at": "2026-06-06T15:00:00Z",
  "metadata": {"payer": "demo", "facility": "demo-hospital", "poa_status": "Y"},
  "documents": [
    {
      "document_id": "WOUND-CONSULT-001",
      "author_role": "physician",
      "recorded_at": "2026-06-01T14:30:00Z",
      "text": "Wound consultation performed. Stage 4 pressure injury of the sacral region with exposed muscle. Present on admission. Continue pressure redistribution."
    }
  ],
  "claim": {
    "diagnoses": ["A41.9"],
    "procedures": [],
    "charges": ["ROOM-BOARD"],
    "drg": "DEMO-292",
    "allowed_amount_cents": 1000000
  }
}

